{
  "$schema": "http://json-schema.org/draft-07/schema#",
  "title": "Evidence",
  "type": "object",
  "properties": {
    "schema_version": { "type": "integer", "const": 1 },
    "evidence_id": { "type": "string" },
    "step_id": { "type": "string" },
    "check": { "type": "object" },
    "collector": { "type": "string" },
    "collected_at": { "type": "string" },
    "observed": { "type": "object" },
    "expected": { "type": "object" },
    "match": { "type": "boolean" },
    "nonce": { "type": "string" },
    "record_sha256": { "type": "string" }
  },
  "required": [
    "schema_version", "evidence_id", "step_id", "check", "collector",
    "collected_at", "observed", "expected", "match", "nonce", "record_sha256"
  ],
  "additionalProperties": false
}
